{
  "id": "uber-base",
  "name": "Base",
  "source": "https://base.uber.com/",
  "maker": "Uber",
  "fit": "One foundation shared across many Uber products.",
  "atmosphere": "Unconfirmed.",
  "principles": "One foundation for Uber's products: system principles, a design language, components, patterns, and extensions for product verticals.",
  "color": "Unconfirmed.",
  "typography": "Unconfirmed.",
  "spacing": "Unconfirmed.",
  "shape": "Unconfirmed.",
  "elevation": "Unconfirmed.",
  "layout": "Unconfirmed.",
  "logo": "Unconfirmed.",
  "icons": "Unconfirmed.",
  "motion": "Unconfirmed.",
  "components": "Shared components, plus extension patterns for product verticals. Exact names are Unconfirmed.",
  "patterns": "Unconfirmed.",
  "content": "Unconfirmed.",
  "accessibility": "Unconfirmed.",
  "governance": "Unconfirmed.",
  "themes": "Unconfirmed.",
  "adapt": "Keep the idea of one foundation shared by many products. Open the source before using a color, type size, space, or shadow. Replace Uber's brand."
}
