{
  "id": "lightning",
  "name": "Lightning Design System",
  "source": "https://www.lightningdesignsystem.com/",
  "maker": "Salesforce",
  "fit": "Record-heavy CRM and admin apps.",
  "atmosphere": "Unconfirmed.",
  "principles": "Density, scannable records, and one clear path through a form. Motion is named kinetics.",
  "color": "A blue brand on a gray page, with semantic colors for success, warning, and error.",
  "typography": "A sans scale from page header to small meta text.",
  "spacing": "A spacing scale tied to component padding.",
  "shape": "Slightly rounded controls.",
  "elevation": "Modals and menus are elevated. Record pages are flat.",
  "layout": "Templates for record home, list view, and related lists.",
  "logo": "Unconfirmed.",
  "icons": "A large utility and standard icon set.",
  "motion": "Unconfirmed.",
  "components": "Button, input, data table, path, modal, and global header.",
  "patterns": "Unconfirmed.",
  "content": "Unconfirmed.",
  "accessibility": "Unconfirmed.",
  "governance": "Unconfirmed.",
  "themes": "Unconfirmed.",
  "adapt": "Keep record and list patterns only if the product is record-shaped. Replace Salesforce blue and the global header."
}
